id,title,score,num_comments,author,created_utc,url,over_18,edited,spoiler,stickied
1ehlebx,Sr. Data Engineer vs excel guy,1307,51,nobilix,2024-08-01 16:44:38,https://i.redd.it/0q52otpzz2gd1.png,False,False,False,False
1eh05ya,What separates the average DE from a desirable DE in this market?,98,57,git0ffmylawnm8,2024-07-31 22:17:11,https://www.reddit.com/r/dataengineering/comments/1eh05ya/what_separates_the_average_de_from_a_desirable_de/,False,False,False,False
1eh7aux,Which database should I choose for a large database?,43,57,Practical_Slip6791,2024-08-01 03:59:42,https://www.reddit.com/r/dataengineering/comments/1eh7aux/which_database_should_i_choose_for_a_large/,False,False,False,False
1ehpzgc,Senior vs. Staff Data Engineer,47,2,durhoward,2024-08-01 19:51:09,https://i.redd.it/4qxlhe5pw3gd1.png,False,False,False,False
1ehcd6q,Is this book worth reading ? pls give some reviews if anyone of you has read it,34,7,OpenWeb5282,2024-08-01 09:28:05,https://i.redd.it/yy1fq9i2u0gd1.jpeg,False,False,False,False
1eh4dyn,What are data engineering tools/systems that have a funny name?,20,36,inner-musician-5457,2024-08-01 01:30:32,https://www.reddit.com/r/dataengineering/comments/1eh4dyn/what_are_data_engineering_toolssystems_that_have/,False,False,False,False
1ehhr08,What is the easiest experience you've had applying for a data engineer job?,19,36,Novel-Tree7557,2024-08-01 14:14:34,https://www.reddit.com/r/dataengineering/comments/1ehhr08/what_is_the_easiest_experience_youve_had_applying/,False,False,False,False
1eh4hrh,DuckDB in production ,17,7,Snoo_70708,2024-08-01 01:35:45,https://www.reddit.com/r/dataengineering/comments/1eh4hrh/duckdb_in_production/,False,False,False,False
1ehc2rt,Is Nifi that Important ?,15,5,Ancient_Quiet_790,2024-08-01 09:07:54,https://www.reddit.com/r/dataengineering/comments/1ehc2rt/is_nifi_that_important/,False,False,False,False
1ehbgfl,Is it a good idea to use Polars with Pyspark?,16,14,Schlooooompy,2024-08-01 08:25:00,https://www.reddit.com/r/dataengineering/comments/1ehbgfl/is_it_a_good_idea_to_use_polars_with_pyspark/,False,False,False,False
1eh11bc,Learning Data Engineering (Project Advice),6,1,Spiritual-Battle5723,2024-07-31 22:54:22,https://www.reddit.com/r/dataengineering/comments/1eh11bc/learning_data_engineering_project_advice/,False,False,False,False
1ehlg5u,"Will Spark speed up my pipeline, Airflow, BigQuery",4,8,nem03,2024-08-01 16:46:35,https://www.reddit.com/r/dataengineering/comments/1ehlg5u/will_spark_speed_up_my_pipeline_airflow_bigquery/,False,False,False,False
1ehkasi,Monthly General Discussion - Aug 2024,7,3,AutoModerator,2024-08-01 16:00:31,https://www.reddit.com/r/dataengineering/comments/1ehkasi/monthly_general_discussion_aug_2024/,False,False,False,True
1ehcxt6,Pipeline Failure due to bin-log expiry,2,1,Suspicious_Peanut282,2024-08-01 10:06:00,https://www.reddit.com/r/dataengineering/comments/1ehcxt6/pipeline_failure_due_to_binlog_expiry/,False,False,False,False
1egzott,Data engineering primer for a data scientist,2,1,AngryDuckling1,2024-07-31 21:57:58,https://www.reddit.com/r/dataengineering/comments/1egzott/data_engineering_primer_for_a_data_scientist/,False,False,False,False
1ehnq6m,Is it possible to automate exporting raw data from Google Analytics without using an API call?,3,2,Quick123Fox,2024-08-01 18:18:17,https://i.redd.it/1p8mlmhsg3gd1.jpeg,False,False,False,False
1ehawol,Industry practice for distributed streaming/processing?,3,4,luqmancrit69,2024-08-01 07:46:41,https://www.reddit.com/r/dataengineering/comments/1ehawol/industry_practice_for_distributed/,False,False,False,False
1eh5fox,Clickhouse on kubernetes,3,2,PrimaryConsistent262,2024-08-01 02:21:24,https://www.reddit.com/r/dataengineering/comments/1eh5fox/clickhouse_on_kubernetes/,False,False,False,False
1eh3rmn,Ideas for this project ,3,4,Key_Perspective6112,2024-08-01 01:00:46,https://www.reddit.com/r/dataengineering/comments/1eh3rmn/ideas_for_this_project/,False,False,False,False
1eh1gkr,How to profile and resource limit duckdb,3,0,SAsad01,2024-07-31 23:13:04,https://www.reddit.com/r/dataengineering/comments/1eh1gkr/how_to_profile_and_resource_limit_duckdb/,False,False,False,False
1ehpcig,Easiest way to automate getting data from Bing/Microsoft Ads data into a Google Sheet?,2,0,rankRascal,2024-08-01 19:24:06,https://www.reddit.com/r/dataengineering/comments/1ehpcig/easiest_way_to_automate_getting_data_from/,False,False,False,False
1ehnlry,Anyone experience with AWS SDLF ,2,0,LokeReven,2024-08-01 18:13:24,https://www.reddit.com/r/dataengineering/comments/1ehnlry/anyone_experience_with_aws_sdlf/,False,False,False,False
1ehn5o1,Is there growth and learning for data engineers in hospital/healthcare companies that use mainly Epic db/dw? ,2,1,UnfairDiscount8331,2024-08-01 17:55:33,https://www.reddit.com/r/dataengineering/comments/1ehn5o1/is_there_growth_and_learning_for_data_engineers/,False,False,False,False
1ehmfq7,Technical vs Subject Matter skills,2,0,date_uh,2024-08-01 17:26:24,https://www.reddit.com/r/dataengineering/comments/1ehmfq7/technical_vs_subject_matter_skills/,False,False,False,False
1ehhmzs,How Airbyte 1.0 orchestrates data movement jobs,1,0,arimbr,2024-08-01 14:09:49,https://airbyte.com/blog/introducing-workloads-how-airbyte-1-0-orchestrates-data-movement-jobs,False,False,False,False
1ehaxa6,Is anyone else having lots of troubles with the new salesforce connector in data factory?,2,0,kbic93,2024-08-01 07:47:48,https://www.reddit.com/r/dataengineering/comments/1ehaxa6/is_anyone_else_having_lots_of_troubles_with_the/,False,False,False,False
1eh8z70,RDS MySQL -> Snowflake CDC,2,0,josejo9423,2024-08-01 05:38:04,https://www.reddit.com/r/dataengineering/comments/1eh8z70/rds_mysql_snowflake_cdc/,False,False,False,False
1eh0av7,dumb question-Mining historical cost data,2,1,SheepherderFamous510,2024-07-31 22:23:07,https://www.reddit.com/r/dataengineering/comments/1eh0av7/dumb_questionmining_historical_cost_data/,False,False,False,False
1egzdoy,How Data Encryption Can Simplify Infrastructure Architecture,2,0,CharmingOwl4972,2024-07-31 21:45:07,https://www.reddit.com/r/dataengineering/comments/1egzdoy/how_data_encryption_can_simplify_infrastructure/,False,False,False,False
1ehpopj,Is HP Laptop R7 7730U good enough for study in data engineering?,1,0,Moist-Sample9534,2024-08-01 19:38:49,https://www.reddit.com/r/dataengineering/comments/1ehpopj/is_hp_laptop_r7_7730u_good_enough_for_study_in/,False,False,False,False
1ehotxh,What to Expect,1,3,Standard_Penalty5182,2024-08-01 19:03:08,https://www.reddit.com/r/dataengineering/comments/1ehotxh/what_to_expect/,False,False,False,False
1ehnidp,Multi Vendor dataset- single product,1,1,cida1205,2024-08-01 18:09:30,https://www.reddit.com/r/dataengineering/comments/1ehnidp/multi_vendor_dataset_single_product/,False,False,False,False
1ehr1qj,Why CSV is still king,0,0,PiccoloCareful924,2024-08-01 20:34:03,https://konbert.com/blog/why-csv-is-still-king,False,False,False,False
